,sentence,word_labels
518,Vanity Tray Intended Use: Designed to be used as an ornamental object and/or display your most coveted possessions.,"B-PRODUCT,I-PRODUCT,O,O,O,O,O,O,O,O,O,O,O,O,O,O,O,O"
519,"Mindo 108 Small Pouf Create your own lounge environment with a few flexible poufs. Ideal for the small terrace, rooftop bar or as an extra seat with your more classic lounge group. mindo 108 is available in two sizes and heights. Designed with a strong aluminium frame with a special combined upholstery solution, giving it a modern look that is pleasant to the touch. Designed for outdoor as well as indoor use, and comes in three colourways/ fabric versions.","B-PRODUCT,I-PRODUCT,I-PRODUCT,I-PRODUCT,O,O,O,O,O,O,O,O,O,O,O,O,O,O,O,O,O,O,O,O,O,O,O,O,O,O,O,O,O,O,O,O,O,O,O,O,O,O,O,O,O,O,O,O,O,O,O,O,O,O,O,O,O,O,O,O,O,O,O,O,O,O,O,O,O,O,O,O,O,O,O,O,O,O,O"
520,Spargo Sofa This Spargo three seater sofa has buttoned-turfed back cushions and are zipped into the frame for stability and is detachable. This piece of furniture is modern with velvet upholstery and angled black steel feet.,"B-PRODUCT,I-PRODUCT,O,O,O,O,O,O,O,O,O,O,O,O,O,O,O,O,O,O,O,O,O,O,O,O,O,O,O,O,O,O,O,O,O,O"
521,Joshua Oak Bedside Pedestal This sleek and versatile natural Oak bedside table will work in any bedroom. This is a custom made bedside table from warm natural Oak with sturdy turned legs and one pull out drawer.,"B-PRODUCT,I-PRODUCT,I-PRODUCT,I-PRODUCT,O,O,O,O,O,O,O,O,O,O,O,O,O,O,O,O,O,O,O,O,O,O,O,O,O,O,O,O,O,O,O,O,O"
522,Cinematique Armchair All products are subject to availability. Prices exclude delivery. Delivery is outsourced and takes 3- 6 working days to arrive nationally,"B-PRODUCT,I-PRODUCT,O,O,O,O,O,O,O,O,O,O,O,O,O,O,O,O,O,O,O,O,O"
523,Heidi Armchair - Wheat Please note: All products are subject to availability. Orders take 3 to 6 working days to arrive nationally. Prices exclude delivery.,"B-PRODUCT,I-PRODUCT,I-PRODUCT,I-PRODUCT,O,O,O,O,O,O,O,O,O,O,O,O,O,O,O,O,O,O,O,O,O"
524,Gibbon Slack Line - Classic 15m,"B-PRODUCT,I-PRODUCT,I-PRODUCT,I-PRODUCT,I-PRODUCT,I-PRODUCT"
525,Chaise Hamac Cotton Macrame Laguna,"B-PRODUCT,I-PRODUCT,I-PRODUCT,I-PRODUCT,I-PRODUCT"
526,Chaise Hamac Cotton Chair Guatemala,"B-PRODUCT,I-PRODUCT,I-PRODUCT,I-PRODUCT,I-PRODUCT"
527,Chaise Hamac Cotton Chair Rainbow,"B-PRODUCT,I-PRODUCT,I-PRODUCT,I-PRODUCT,I-PRODUCT"
528,"bitossi dachschund dog figure ZZ999-44 series, signed by master ceramist Aldo Londi, has been produced by the Manifattura Bitossi since 1959. The pieces are decorated with thick signs on the shapes during the production phase. The collection is inspired by the various shades of colours that are fixed under the blue glaze and, after being heated, reproduce the magical reflections of light in the sea.","B-PRODUCT,I-PRODUCT,I-PRODUCT,I-PRODUCT,I-PRODUCT,O,O,O,O,O,O,O,O,O,O,O,O,O,O,O,O,O,O,O,O,O,O,O,O,O,O,O,O,O,O,O,O,O,O,O,O,O,O,O,O,O,O,O,O,O,O,O,O,O,O,O,O,O,O,O,O,O,O,O,O"
529,"bitossi ZZ999-121 dove figure ceramic pottery Hand-turned in white refractory clay. Decoration engraved by hand with various patterns stencilled on raw clay, under glossy blue crystalline glaze.","B-PRODUCT,I-PRODUCT,I-PRODUCT,I-PRODUCT,I-PRODUCT,I-PRODUCT,O,O,O,O,O,O,O,O,O,O,O,O,O,O,O,O,O,O,O,O,O"
530,"bitossi ceramiche long cat figure ZZ999-37 Decoration engraved by hand with various patterns stencilled on raw clay, under glossy blue crystalline glaze.","B-PRODUCT,I-PRODUCT,I-PRODUCT,I-PRODUCT,I-PRODUCT,I-PRODUCT,O,O,O,O,O,O,O,O,O,O,O,O,O,O,O,O"
531,"zanotta 850 sant'elia armchair Zanotta has been one of the biggest players in the Italian and international design scene since its creation in 1954. From the very beginning, the company has produced","B-PRODUCT,I-PRODUCT,I-PRODUCT,I-PRODUCT,O,O,O,O,O,O,O,O,O,O,O,O,O,O,O,O,O,O,O,O,O,O,O,O,O,O,O,O"
532,"Aria Wood Chair SohoConcept features a great selection of modern furniture such as sofas, dining chairs, stools, office and lounge chairs and more! Our collection includes a range of contemporary and modern furniture suitable for contract or residential projects of any size. sohoConcept can help you with your interior design and decorating!","B-PRODUCT,I-PRODUCT,I-PRODUCT,O,O,O,O,O,O,O,O,O,O,O,O,O,O,O,O,O,O,O,O,O,O,O,O,O,O,O,O,O,O,O,O,O,O,O,O,O,O,O,O,O,O,O,O,O,O,O,O,O"
533,"Crescent Star Chair SohoConcept features a great selection of modern furniture such as sofas, dining chairs, stools, office and lounge chairs and more! Our collection includes a range of contemporary and modern furniture suitable for contract or residential projects of any size. sohoConcept can help you with your interior design and decorating!","B-PRODUCT,I-PRODUCT,I-PRODUCT,O,O,O,O,O,O,O,O,O,O,O,O,O,O,O,O,O,O,O,O,O,O,O,O,O,O,O,O,O,O,O,O,O,O,O,O,O,O,O,O,O,O,O,O,O,O,O,O,O"
534,"Aria Wood Stools SohoConcept features a great selection of modern furniture such as sofas, dining chairs, stools, office and lounge chairs and more! Our collection includes a range of contemporary and modern furniture suitable for contract or residential projects of any size. sohoConcept can help you with your interior design and decorating!","B-PRODUCT,I-PRODUCT,I-PRODUCT,O,O,O,O,O,O,O,O,O,O,O,O,O,O,O,O,O,O,O,O,O,O,O,O,O,O,O,O,O,O,O,O,O,O,O,O,O,O,O,O,O,O,O,O,O,O,O,O,O"
535,"Eiffel MW Dining Chair SohoConcept features a great selection of modern furniture such as sofas, dining chairs, stools, office and lounge chairs and more! Our collection includes a range of contemporary and modern furniture suitable for contract or residential projects of any size. sohoConcept can help you with your interior design and decorating!","B-PRODUCT,I-PRODUCT,I-PRODUCT,I-PRODUCT,O,O,O,O,O,O,O,O,O,O,O,O,O,O,O,O,O,O,O,O,O,O,O,O,O,O,O,O,O,O,O,O,O,O,O,O,O,O,O,O,O,O,O,O,O,O,O,O,O"
536,"Scandinavian Mid-Century Teak Sewing Cart Or Table If it is sold, and you just wish to be notified if we find another like it.","B-PRODUCT,I-PRODUCT,I-PRODUCT,I-PRODUCT,I-PRODUCT,I-PRODUCT,I-PRODUCT,O,O,O,O,O,O,O,O,O,O,O,O,O,O,O,O,O"
537,"Hand Made Cutting Boards Every component is made locally by an artisan carpenter. Kiln dried hardwood ensures that your cutting board will not warp bend or crack. Glued using VOC free, food grade, water safe glue and sanded to a smooth finish with multiple runs of increasingly fine sandpaper. With every cut we make, every hole we drill and every stroke of our brush, we have the end result in mind – always focusing on the best quality and most beautiful finished product for you and your family. Creating something that is beyond trend, an item which becomes a treasured family heirloom.","B-PRODUCT,I-PRODUCT,I-PRODUCT,I-PRODUCT,O,O,O,O,O,O,O,O,O,O,O,O,O,O,O,O,O,O,O,O,O,O,O,O,O,O,O,O,O,O,O,O,O,O,O,O,O,O,O,O,O,O,O,O,O,O,O,O,O,O,O,O,O,O,O,O,O,O,O,O,O,O,O,O,O,O,O,O,O,O,O,O,O,O,O,O,O,O,O,O,O,O,O,O,O,O,O,O,O,O,O,O,O,O,O,O,O,O"
538,"Large Mid-Century Modern Ceramic And Teak Table Lamp If it is sold, and you just wish to be notified if we find another like it.","B-PRODUCT,I-PRODUCT,I-PRODUCT,I-PRODUCT,I-PRODUCT,I-PRODUCT,I-PRODUCT,I-PRODUCT,O,O,O,O,O,O,O,O,O,O,O,O,O,O,O,O,O"
539,"Laurel Lamp Model V 1428 By Richard Barr beautiful, thick, angular lucite tops refract light and have cobalt blue bottoms. Creating a kaleidoscope of shapes depending on the viewing angle. Truly stunning pieces of art that function as lamps. Validated by the Laurel Lamp Foundation.","B-PRODUCT,I-PRODUCT,I-PRODUCT,I-PRODUCT,I-PRODUCT,I-PRODUCT,I-PRODUCT,I-PRODUCT,O,O,O,O,O,O,O,O,O,O,O,O,O,O,O,O,O,O,O,O,O,O,O,O,O,O,O,O,O,O,O,O,O,O,O,O,O"
540,Knoll Saarinen Tulip Dining Table Oval Use code winter10 for 10% off over £750 | Use code winter15 for 15% off over £1800 | Use code winter20 for 20% off over £3500. SALE ENDS 31ST JANUARY,"B-PRODUCT,I-PRODUCT,I-PRODUCT,I-PRODUCT,I-PRODUCT,I-PRODUCT,O,O,O,O,O,O,O,O,O,O,O,O,O,O,O,O,O,O,O,O,O,O,O,O,O,O,O,O,O,O"
541,Bace Sofa Use code winter10 for 10% off over £750 | Use code winter15 for 15% off over £1800 | Use code winter20 for 20% off over £3500. SALE ENDS 31ST JANUARY,"B-PRODUCT,I-PRODUCT,O,O,O,O,O,O,O,O,O,O,O,O,O,O,O,O,O,O,O,O,O,O,O,O,O,O,O,O,O,O"
542,Concord High back chair Use code winter10 for 10% off over £750 | Use code winter15 for 15% off over £1800 | Use code winter20 for 20% off over £3500. SALE ENDS 31ST JANUARY,"B-PRODUCT,I-PRODUCT,I-PRODUCT,I-PRODUCT,O,O,O,O,O,O,O,O,O,O,O,O,O,O,O,O,O,O,O,O,O,O,O,O,O,O,O,O,O,O"
543,Eva Sofa Use code winter10 for 10% off over £750 | Use code winter15 for 15% off over £1800 | Use code winter20 for 20% off over £3500. SALE ENDS 31ST JANUARY,"B-PRODUCT,I-PRODUCT,O,O,O,O,O,O,O,O,O,O,O,O,O,O,O,O,O,O,O,O,O,O,O,O,O,O,O,O,O,O"
544,Sideboard - 3 Drawers 3 Doors - Solid Wood Your guarantee begins on the date you register your warranty. All orders must be registered within 30 days of receiving their order to activate their 2-year guarantee.,"B-PRODUCT,I-PRODUCT,I-PRODUCT,I-PRODUCT,I-PRODUCT,I-PRODUCT,I-PRODUCT,I-PRODUCT,I-PRODUCT,O,O,O,O,O,O,O,O,O,O,O,O,O,O,O,O,O,O,O,O,O,O,O,O,O,O,O"
545,Solid Wood TV Unit - Pine Your guarantee begins on the date you register your warranty. All orders must be registered within 30 days of receiving their order to activate their 2-year guarantee.,"B-PRODUCT,I-PRODUCT,I-PRODUCT,I-PRODUCT,I-PRODUCT,I-PRODUCT,O,O,O,O,O,O,O,O,O,O,O,O,O,O,O,O,O,O,O,O,O,O,O,O,O,O,O"
546,Anya glass dining table set - 6 seater - white Your guarantee begins on the date you register your warranty. All orders must be registered within 30 days of receiving their order to activate their 2-year guarantee.,"B-PRODUCT,I-PRODUCT,I-PRODUCT,I-PRODUCT,I-PRODUCT,I-PRODUCT,I-PRODUCT,I-PRODUCT,I-PRODUCT,I-PRODUCT,O,O,O,O,O,O,O,O,O,O,O,O,O,O,O,O,O,O,O,O,O,O,O,O,O,O,O"
547,"Sienna Dressing Table, Stool & Mirror Set - White Painted Your guarantee begins on the date you register your warranty. All orders must be registered within 30 days of receiving their order to activate their 2-year guarantee.","B-PRODUCT,I-PRODUCT,I-PRODUCT,I-PRODUCT,I-PRODUCT,I-PRODUCT,I-PRODUCT,I-PRODUCT,I-PRODUCT,I-PRODUCT,O,O,O,O,O,O,O,O,O,O,O,O,O,O,O,O,O,O,O,O,O,O,O,O,O,O,O"
548,"Irish Coast African Dusk China Display Cabinet The Irish Coast African Dusk China Display Cabinet is constructed using tempered glass for durability and safety, while each shelf's integrated plate rail provides secure vertical support for displayed objects.","B-PRODUCT,I-PRODUCT,I-PRODUCT,I-PRODUCT,I-PRODUCT,I-PRODUCT,I-PRODUCT,O,O,O,O,O,O,O,O,O,O,O,O,O,O,O,O,O,O,O,O,O,O,O,O,O,O,O,O,O,O"
549,"Chorus Outdoor Sofa Includes Sunbrella® Cushions with thick seat pads and overstuffed back support to ensure the comfort of you and your guests. Cushions are customizable, available in a variety of fabric and pattern options, and resistant to stains, sun damage, mold, and mildew.","B-PRODUCT,I-PRODUCT,I-PRODUCT,O,O,O,O,O,O,O,O,O,O,O,O,O,O,O,O,O,O,O,O,O,O,O,O,O,O,O,O,O,O,O,O,O,O,O,O,O,O,O,O,O"
550,"Chorus Outdoor Right Module Includes cushions with thick seat pads and overstuffed back support to ensure the comfort of your guests. Cushions are customizable, with a variety of fabric and pattern options, and resistant to stains, sun damage, mold, and mildew.","B-PRODUCT,I-PRODUCT,I-PRODUCT,I-PRODUCT,O,O,O,O,O,O,O,O,O,O,O,O,O,O,O,O,O,O,O,O,O,O,O,O,O,O,O,O,O,O,O,O,O,O,O,O,O"
551,"Chorus 24"" Outdoor Square Side Table Your home is a reflection of who you are, our store is a reflection of us. Together let’s create something stylish, beautiful and a pleasure to the senses. At Moss we offer inspiration with our vast selection of products to make your house your","B-PRODUCT,I-PRODUCT,I-PRODUCT,I-PRODUCT,I-PRODUCT,I-PRODUCT,O,O,O,O,O,O,O,O,O,O,O,O,O,O,O,O,O,O,O,O,O,O,O,O,O,O,O,O,O,O,O,O,O,O,O,O,O,O,O,O,O,O,O,O"
552,"Sela Denim Chair Pad, 18"" This super soft, chairpad seat cushion is made in Canada with a luxuriously plush cover made from weatherproof and sunsafe polyester with a polyester fiber fill. Established in 1981 Lady Rosedale uses only the finest and most on trend fabrics with signature impeccable style.","B-PRODUCT,I-PRODUCT,I-PRODUCT,I-PRODUCT,I-PRODUCT,O,O,O,O,O,O,O,O,O,O,O,O,O,O,O,O,O,O,O,O,O,O,O,O,O,O,O,O,O,O,O,O,O,O,O,O,O,O,O,O,O,O,O,O"
553,"Allover Diamond Hexagon Placemat Your home is a reflection of who you are, our store is a reflection of us. Together let’s create something stylish, beautiful and a pleasure to the senses. At Moss we offer inspiration with our vast selection of products to make your house your","B-PRODUCT,I-PRODUCT,I-PRODUCT,I-PRODUCT,O,O,O,O,O,O,O,O,O,O,O,O,O,O,O,O,O,O,O,O,O,O,O,O,O,O,O,O,O,O,O,O,O,O,O,O,O,O,O,O,O,O,O,O"
554,"Pensicola Bay Blue Rectangular Outdoor Cushion Made in Canada from weatherproof and sunsafe polyester with a polyester fiber fill, this luxuriously plush toss pillow will fit perfectly into a variety of patio and home decors. Established in 1981 Lady Rosedale uses only the finest and most on trend fabrics with signature impeccable style.","B-PRODUCT,I-PRODUCT,I-PRODUCT,I-PRODUCT,I-PRODUCT,I-PRODUCT,O,O,O,O,O,O,O,O,O,O,O,O,O,O,O,O,O,O,O,O,O,O,O,O,O,O,O,O,O,O,O,O,O,O,O,O,O,O,O,O,O,O,O,O,O,O,O"
555,"Tweet Toile Robin's Egg Rectangular Outdoor Cushion Made in Canada from weatherproof and sunsafe polyester & acrylic with a polyester fiber fill, this luxuriously plush toss pillow will fit perfectly into a variety of patio and home decors. Established in 1981 Lady Rosedale uses only the finest and most on trend fabrics with signature impeccable style.","B-PRODUCT,I-PRODUCT,I-PRODUCT,I-PRODUCT,I-PRODUCT,I-PRODUCT,I-PRODUCT,O,O,O,O,O,O,O,O,O,O,O,O,O,O,O,O,O,O,O,O,O,O,O,O,O,O,O,O,O,O,O,O,O,O,O,O,O,O,O,O,O,O,O,O,O,O,O,O,O"
556,"Pinecone With Red Berries Candle Ring, 4""Dia Your home is a reflection of who you are, our store is a reflection of us. Together let’s create something stylish, beautiful and a pleasure to the senses. At Moss we offer inspiration with our vast selection of products to make your house your","B-PRODUCT,I-PRODUCT,I-PRODUCT,I-PRODUCT,I-PRODUCT,I-PRODUCT,I-PRODUCT,O,O,O,O,O,O,O,O,O,O,O,O,O,O,O,O,O,O,O,O,O,O,O,O,O,O,O,O,O,O,O,O,O,O,O,O,O,O,O,O,O,O,O,O"
557,"Pine & Berry Garland Your home is a reflection of who you are, our store is a reflection of us. Together let’s create something stylish, beautiful and a pleasure to the senses. At Moss we offer inspiration with our vast selection of products to make your house your","B-PRODUCT,I-PRODUCT,I-PRODUCT,I-PRODUCT,O,O,O,O,O,O,O,O,O,O,O,O,O,O,O,O,O,O,O,O,O,O,O,O,O,O,O,O,O,O,O,O,O,O,O,O,O,O,O,O,O,O,O,O"
558,"Gift Tag & Twine Set of 60 Your home is a reflection of who you are, our store is a reflection of us. Together let’s create something stylish, beautiful and a pleasure to the senses. At Moss we offer inspiration with our vast selection of products to make your house your","B-PRODUCT,I-PRODUCT,I-PRODUCT,I-PRODUCT,I-PRODUCT,I-PRODUCT,I-PRODUCT,O,O,O,O,O,O,O,O,O,O,O,O,O,O,O,O,O,O,O,O,O,O,O,O,O,O,O,O,O,O,O,O,O,O,O,O,O,O,O,O,O,O,O,O"
559,"Kikkerland Brass Bike Bell Your home is a reflection of who you are, our store is a reflection of us. Together let’s create something stylish, beautiful and a pleasure to the senses. At Moss we offer inspiration with our vast selection of products to make your house your","B-PRODUCT,I-PRODUCT,I-PRODUCT,I-PRODUCT,O,O,O,O,O,O,O,O,O,O,O,O,O,O,O,O,O,O,O,O,O,O,O,O,O,O,O,O,O,O,O,O,O,O,O,O,O,O,O,O,O,O,O,O"
560,"Felix Cat Tree with hammock With such a complete tower you will have plenty to do when your master goes to work: rest, stretch your legs, play... In addition, the very soft surface will also remind you of his hugs!","B-PRODUCT,I-PRODUCT,I-PRODUCT,I-PRODUCT,I-PRODUCT,O,O,O,O,O,O,O,O,O,O,O,O,O,O,O,O,O,O,O,O,O,O,O,O,O,O,O,O,O,O,O,O,O,O,O"
561,L'Oreal Steampod 3 Hair Straightener The arrows should always point in the direction of the tips to allow steam to activate Steampod products.,"B-PRODUCT,I-PRODUCT,I-PRODUCT,I-PRODUCT,I-PRODUCT,O,O,O,O,O,O,O,O,O,O,O,O,O,O,O,O,O,O"
562,"LEON Vintage coffee table with graphic patterns The pretty ethnic prints reflect a beautiful imitation parquet, or for adventurous spirits it evokes the veins of a leaf or a feather pattern to create a chic and cozy exotic living room that invites you to travel!","B-PRODUCT,I-PRODUCT,I-PRODUCT,I-PRODUCT,I-PRODUCT,I-PRODUCT,I-PRODUCT,O,O,O,O,O,O,O,O,O,O,O,O,O,O,O,O,O,O,O,O,O,O,O,O,O,O,O,O,O,O,O,O,O,O,O,O,O,O"
563,Elca Coffee Table with Lift Up Top - Scandinavian Style,"B-PRODUCT,I-PRODUCT,I-PRODUCT,I-PRODUCT,I-PRODUCT,I-PRODUCT,I-PRODUCT,I-PRODUCT,I-PRODUCT,I-PRODUCT"
564,CUP HOLDER 2 TIER 33136,"B-PRODUCT,I-PRODUCT,I-PRODUCT,I-PRODUCT,I-PRODUCT"
565,PLATE FOR SECTIONAL CONNECTOR,"B-PRODUCT,I-PRODUCT,I-PRODUCT,I-PRODUCT"
566,T-NUT 5/16-18 X 5/8,"B-PRODUCT,I-PRODUCT,I-PRODUCT,I-PRODUCT"
567,Plastic Triangle Leg 7',"B-PRODUCT,I-PRODUCT,I-PRODUCT,I-PRODUCT"
568,"12"" Steel Swivel Base","B-PRODUCT,I-PRODUCT,I-PRODUCT,I-PRODUCT"
569,LS-30 OAK 30 inches in diameter,"B-PRODUCT,I-PRODUCT,I-PRODUCT,I-PRODUCT,I-PRODUCT,I-PRODUCT"
570,American Cherry stain on Cherry,"B-PRODUCT,I-PRODUCT,I-PRODUCT,I-PRODUCT,I-PRODUCT"
571,Base 24 24 inches in diameter,"B-PRODUCT,I-PRODUCT,I-PRODUCT,I-PRODUCT,I-PRODUCT,I-PRODUCT"
572,"9 pc Monterey Teak Dining Set with Expansion Table. Sunbrella Cushion 9pc Monterey Teak Dining Set with 79/102.5"""" Expansion Dining Table with Sunbrella cushions. Handcrafted from the finest teak hardwood timber. We only use premium grade to enhance the natural weather resistance properties of teak. Tenon and joinery construction with dowel reinforcement where extra support is needed. 2.5"" thick Sunbrella seat cushions boasting a solid foam core wrapped in fiber for ultimate comfort are included. Wood is finely sanded to a satin finish. Durability and quality to last for decades.","B-PRODUCT,I-PRODUCT,I-PRODUCT,I-PRODUCT,I-PRODUCT,I-PRODUCT,I-PRODUCT,I-PRODUCT,I-PRODUCT,I-PRODUCT,I-PRODUCT,O,O,O,O,O,O,O,O,O,O,O,O,O,O,O,O,O,O,O,O,O,O,O,O,O,O,O,O,O,O,O,O,O,O,O,O,O,O,O,O,O,O,O,O,O,O,O,O,O,O,O,O,O,O,O,O,O,O,O,O,O,O,O,O,O,O,O,O,O,O,O,O,O,O,O,O,O,O,O"
573,"Set of 2 Pacific Teak Outdoor Chaise Lounger. Sunbrella Cushion. Set of 2 Pacific Teak Outdoor Chaise Lounge. Handcrafted from the finest teak hardwood timber. We only use premium grade to enhance the natural weather resistance properties of teak. Tenon and joinery construction with dowel reinforcement where extra support is needed. 5"" thick Sunbrella seat and back cushions boasting a solid foam core wrapped in fiber and overstuffed back cushions for ultimate comfort are included. Wood is finely sanded to a satin finish. Durability and quality to last for decades.","B-PRODUCT,I-PRODUCT,I-PRODUCT,I-PRODUCT,I-PRODUCT,I-PRODUCT,I-PRODUCT,I-PRODUCT,I-PRODUCT,I-PRODUCT,O,O,O,O,O,O,O,O,O,O,O,O,O,O,O,O,O,O,O,O,O,O,O,O,O,O,O,O,O,O,O,O,O,O,O,O,O,O,O,O,O,O,O,O,O,O,O,O,O,O,O,O,O,O,O,O,O,O,O,O,O,O,O,O,O,O,O,O,O,O,O,O,O,O,O,O,O,O,O,O"
574,"7 pc Monterey Teak Dining Set with 72"" Rectangle Dining Table. Sunbrella Cushion. 7pc Monterey Teak Dining Set with 72"" Rectangular Dining Table with Sunbrella cushions. Handcrafted from the finest teak hardwood timber. We only use premium grade to enhance the natural weather resistance properties of teak. Tenon and joinery construction with dowel reinforcement where extra support is needed. 2.5"" thick Sunbrella seat cushions boasting a solid foam core wrapped in fiber for ultimate comfort are included. Wood is finely sanded to a satin finish. Durability and quality to last for decades.","B-PRODUCT,I-PRODUCT,I-PRODUCT,I-PRODUCT,I-PRODUCT,I-PRODUCT,I-PRODUCT,I-PRODUCT,I-PRODUCT,I-PRODUCT,I-PRODUCT,I-PRODUCT,I-PRODUCT,O,O,O,O,O,O,O,O,O,O,O,O,O,O,O,O,O,O,O,O,O,O,O,O,O,O,O,O,O,O,O,O,O,O,O,O,O,O,O,O,O,O,O,O,O,O,O,O,O,O,O,O,O,O,O,O,O,O,O,O,O,O,O,O,O,O,O,O,O,O,O,O,O,O,O,O,O,O,O"
575,"5 pc Monterey Teak Dining Set with 48"" Round Table. Sunbrella Cushion 5pc Monterey teak dining set with 48"" round dining table with Sunbrella cushions. Handcrafted from the finest teak hardwood timber. We only use premium grade to enhance the natural weather resistance properties of teak. Tenon and joinery construction with dowel reinforcement where extra support is needed. 2.5"" thick Sunbrella seat cushions boasting a solid foam core wrapped in fiber for ultimate comfort are included. Wood is finely sanded to a satin finish. Durability and quality to last for decades.","B-PRODUCT,I-PRODUCT,I-PRODUCT,I-PRODUCT,I-PRODUCT,I-PRODUCT,I-PRODUCT,I-PRODUCT,I-PRODUCT,I-PRODUCT,I-PRODUCT,I-PRODUCT,O,O,O,O,O,O,O,O,O,O,O,O,O,O,O,O,O,O,O,O,O,O,O,O,O,O,O,O,O,O,O,O,O,O,O,O,O,O,O,O,O,O,O,O,O,O,O,O,O,O,O,O,O,O,O,O,O,O,O,O,O,O,O,O,O,O,O,O,O,O,O,O,O,O,O,O,O,O,O"
576,Wall chart - Jungle XXL,"B-PRODUCT,I-PRODUCT,I-PRODUCT,I-PRODUCT,I-PRODUCT"
577,"Egg Chair - black Because of the natural material of the chair, it's possible that the rattan can develop small cracks, the twigs can break over time. This does not effect the product quality. To expand the life span of this chair, for extra comfort and to protect your clothing, we do suggest to use a seat cushion or sheepskin.","B-PRODUCT,I-PRODUCT,I-PRODUCT,I-PRODUCT,O,O,O,O,O,O,O,O,O,O,O,O,O,O,O,O,O,O,O,O,O,O,O,O,O,O,O,O,O,O,O,O,O,O,O,O,O,O,O,O,O,O,O,O,O,O,O,O,O,O,O,O,O,O,O,O"
578,Traditional Dutch tablecloth - brown,"B-PRODUCT,I-PRODUCT,I-PRODUCT,I-PRODUCT,I-PRODUCT"
579,Woven throw blanket - chevron,"B-PRODUCT,I-PRODUCT,I-PRODUCT,I-PRODUCT,I-PRODUCT"
580,Design & Consulting Service What's your scene Canada? Vancouver Islands outdoor & patio furniture specialists. Free local delivery and set-up. Customize our furniture to suit your patio needs; with over 100 colour and design combinations we have something to match your style. Ask us about short and tall cushions and receive $25 off your purchase.,"B-PRODUCT,I-PRODUCT,I-PRODUCT,I-PRODUCT,O,O,O,O,O,O,O,O,O,O,O,O,O,O,O,O,O,O,O,O,O,O,O,O,O,O,O,O,O,O,O,O,O,O,O,O,O,O,O,O,O,O,O,O,O,O,O,O,O,O,O"
581,"Monarch ~ Elite ~ 6 Seat Dinette Set Wipe clean with damp cloth. Do not use bleach, acid solvents or abrasive cleaners on artificial wicker or frame parts. During varying weather conditions and winter period, we strongly recommend that the unit be stored in a dry area with a suitable cover. Before storage, please ensure the unit is clean and dry. Do not stand or climb on the chairs.","B-PRODUCT,I-PRODUCT,I-PRODUCT,I-PRODUCT,I-PRODUCT,I-PRODUCT,I-PRODUCT,I-PRODUCT,O,O,O,O,O,O,O,O,O,O,O,O,O,O,O,O,O,O,O,O,O,O,O,O,O,O,O,O,O,O,O,O,O,O,O,O,O,O,O,O,O,O,O,O,O,O,O,O,O,O,O,O,O,O,O,O,O,O,O,O,O"
582,"Tempotest Fabric Home Series Thanks to innovative finishing of Teflon Extreme by Para all Tempotest Home fabrics are water/oil repellent, resistant to mould, stains, salt and U.V. fading, even though they are soft and pleasant to touch like natural-fibre fabrics.","B-PRODUCT,I-PRODUCT,I-PRODUCT,I-PRODUCT,O,O,O,O,O,O,O,O,O,O,O,O,O,O,O,O,O,O,O,O,O,O,O,O,O,O,O,O,O,O,O,O,O,O,O,O"
583,Seat Covers What's your scene Canada? Vancouver Islands outdoor & patio furniture specialists. Free local delivery and set-up. Customize our furniture to suit your patio needs; with over 100 colour and design combinations we have something to match your style. Ask us about short and tall cushions and receive $25 off your purchase.,"B-PRODUCT,I-PRODUCT,O,O,O,O,O,O,O,O,O,O,O,O,O,O,O,O,O,O,O,O,O,O,O,O,O,O,O,O,O,O,O,O,O,O,O,O,O,O,O,O,O,O,O,O,O,O,O,O,O,O,O"
584,"GLASS BEADS, OPAQUE","B-PRODUCT,I-PRODUCT,I-PRODUCT"
585,VERSA POTS,"B-PRODUCT,I-PRODUCT"
586,"Hosley Set of 2, Vine and Leaf Tealight Wall Sconce USE These are perfect for adding a decorative touch to any room's decor. Perfect for everyday use, wedding, events, aromatherapy,Spa, Reiki, Meditation, Bathroom setting.","B-PRODUCT,I-PRODUCT,I-PRODUCT,I-PRODUCT,I-PRODUCT,I-PRODUCT,I-PRODUCT,I-PRODUCT,I-PRODUCT,I-PRODUCT,O,O,O,O,O,O,O,O,O,O,O,O,O,O,O,O,O,O,O,O,O,O,O,O"
587,"Hosley Set of 10, 8 inch Diameter, Glass Mirror Round Pillar Candle Plates -USES: These are just the right gift for a wedding and can be used for a party, reiki, spa. The plates can use Hosley's own pillar candles of various sizes whether scented or unscented candles.","B-PRODUCT,I-PRODUCT,I-PRODUCT,I-PRODUCT,I-PRODUCT,I-PRODUCT,I-PRODUCT,I-PRODUCT,I-PRODUCT,I-PRODUCT,I-PRODUCT,I-PRODUCT,I-PRODUCT,O,O,O,O,O,O,O,O,O,O,O,O,O,O,O,O,O,O,O,O,O,O,O,O,O,O,O,O,O,O,O,O,O,O,O"
588,"Extra Upholstery Cover Set All the tools, accessories and instruction required to assemble the products comes within the packet only.","B-PRODUCT,I-PRODUCT,I-PRODUCT,I-PRODUCT,O,O,O,O,O,O,O,O,O,O,O,O,O,O,O,O"
589,"Solid Wood Charlie Sofa 2 Seater All the tools, accessories and instruction required to assemble the products comes within the packet only.","B-PRODUCT,I-PRODUCT,I-PRODUCT,I-PRODUCT,I-PRODUCT,I-PRODUCT,O,O,O,O,O,O,O,O,O,O,O,O,O,O,O,O"
590,"Solid Wood Cubox Sofa 2 Seater All the tools, accessories and instruction required to assemble the products comes within the packet only.","B-PRODUCT,I-PRODUCT,I-PRODUCT,I-PRODUCT,I-PRODUCT,I-PRODUCT,O,O,O,O,O,O,O,O,O,O,O,O,O,O,O,O"
591,"Solid Wood New Crossia Sofa 2 Seater All the tools, accessories and instruction required to assemble the products comes within the packet only.","B-PRODUCT,I-PRODUCT,I-PRODUCT,I-PRODUCT,I-PRODUCT,I-PRODUCT,I-PRODUCT,O,O,O,O,O,O,O,O,O,O,O,O,O,O,O,O"
592,"Harriet Pouf - Blue Container that holds slides. PhotoSwipe keeps only 3 of them in the DOM to save memory. Don't modify these 3 pswp__item elements, data is added later on.","B-PRODUCT,I-PRODUCT,I-PRODUCT,I-PRODUCT,O,O,O,O,O,O,O,O,O,O,O,O,O,O,O,O,O,O,O,O,O,O,O,O,O,O,O"
593,"Bella Cocktail Chair - Grey Velvet Container that holds slides. PhotoSwipe keeps only 3 of them in the DOM to save memory. Don't modify these 3 pswp__item elements, data is added later on.","B-PRODUCT,I-PRODUCT,I-PRODUCT,I-PRODUCT,I-PRODUCT,I-PRODUCT,O,O,O,O,O,O,O,O,O,O,O,O,O,O,O,O,O,O,O,O,O,O,O,O,O,O,O"
594,"Theo Armchair - Dhurrie Container that holds slides. PhotoSwipe keeps only 3 of them in the DOM to save memory. Don't modify these 3 pswp__item elements, data is added later on.","B-PRODUCT,I-PRODUCT,I-PRODUCT,I-PRODUCT,O,O,O,O,O,O,O,O,O,O,O,O,O,O,O,O,O,O,O,O,O,O,O,O,O,O,O"
